user_input,retrieved_contexts,response,reference,faithfulness,answer_relevancy,context_precision,context_recall
What is a Management Point in SCCM?,"[""Exchange Server connector\nFor information about this role, see Manage mobile devices with Configuration Manager and Exchange.\nFallback status point\nA site system role that helps you monitor client installation. It identifies clients that are unmanaged because they can't communicate with their management point. Although this role is supported only at primary sites, you can install multiple instances of this role at a site, and at multiple sites in the same hierarchy.\nManagement point\nA site system role that provides policy and service location information to clients. It also receives configuration data from clients."", 'In the Configuration Manager console, navigate to Monitoring > Overview > Software Update Point Synchronization Status.\nThe software update points in your Configuration Manager hierarchy are displayed in the results pane. From this view, you can monitor the synchronization status for all software update points. To see more detailed information about the synchronization process, you can review the wsyncmgr.log file, which is located in <ConfigMgrInstallationPath>\\Logs on each site server.', 'Reporting services point\nA site system role that integrates with SQL Server Reporting Services to create and manage reports for Configuration Manager. This role is supported at primary sites and the central administration site, and you can install multiple instances of this role at a supported site. For more information, see Planning for reporting.\nService connection point', 'Uses an industry standard reporting system to query the Configuration Manager database.\n\nDisplays reports by using the Configuration Manager Report Viewer or by using Report Manager, which is a web-based connection to the report.\n\nProvides high performance, availability, and scalability.\n\nProvides subscriptions to reports to which users can subscribe. For example, a manager subscribes to an emailed report each day that details the status of a software update rollout.\n\nExports reports in different kinds of popular formats.\n\n\nFor more information, see What is SQL Server Reporting Services (SSRS)?\nPower BI Report Server', 'Set up management points to support either HTTP or HTTPs. They can also support mobile devices that you manage with Configuration Manager on-premises mobile device management (MDM). To help reduce the processing load placed on the site database server by management points as they service requests from clients, use Database replicas for management points.']","A Management Point is a site system role in SCCM that provides policy and service location information to clients. It also receives configuration data from clients. Additionally, management points can be set up to support either HTTP or HTTPS and can support mobile devices managed with Configuration Manager on-premises mobile device management (MDM).",A Management Point enables communication between Configuration Manager clients and the site server.,1.0,0.9589174184672569,0.699999999965,1.0
What is the role of a Distribution Point?,"['On the Distribution Points page, specify the distribution points or distribution point groups to host the software update files. For more information about distribution points, see Distribution point configurations. This page is available only when you create a new software update deployment package.\n\nThe Distribution Settings page is available only when you create a new software update deployment package. Specify the following settings:', ""Additional management points so that the site can support more devices, up to the site's supported capacity.\n\nAdditional distribution points to expand your content infrastructure, improving the performance of content distributions to devices.\n\nOne or more feature-specific site system roles. For example, a software update point lets you manage software updates for managed devices. A reporting services point lets you run reports to monitor, understand, and share information about your environment."", 'Uses an industry standard reporting system to query the Configuration Manager database.\n\nDisplays reports by using the Configuration Manager Report Viewer or by using Report Manager, which is a web-based connection to the report.\n\nProvides high performance, availability, and scalability.\n\nProvides subscriptions to reports to which users can subscribe. For example, a manager subscribes to an emailed report each day that details the status of a software update rollout.\n\nExports reports in different kinds of popular formats.\n\n\nFor more information, see What is SQL Server Reporting Services (SSRS)?\nPower BI Report Server', 'Important\nAn on-premises distribution point is required in the following scenarios:\n\nResponding to PXE boot requests.\nWhen using multicast.\n\n\nPrepare a PXE-enabled boot image\nTo use PXE to deploy an OS, distribute both x86 and x64 PXE-enabled boot images to one or more PXE-enabled distribution points.\n\nTo enable PXE on a boot image, select Deploy this boot image from the PXE-enabled distribution point from the Data Source tab in the boot image properties.\n\nWhen you change the properties for the boot image, update and redistribute the boot image to distribution points. For more information, see Distribute content.', ""In the Distribution priority list, specify the priority level. Configuration Manager uses this priority list when the site distributes multiple packages to the same distribution point.\n\nIf you want to enable on-demand content distribution to preferred distribution points, select Enable for on-demand distribution. When you enable this setting, if a client requests the content for the package and the content isn't available on any distribution points, then the management point distributes the content. For more information, see On-demand content distribution.""]","A Distribution Point is a site system role in Configuration Manager that hosts software update files, allowing devices to access and download the updates. The role of a Distribution Point is to expand the content infrastructure, improving the performance of content distributions to devices. Additionally, a Distribution Point is required in certain scenarios, such as responding to PXE boot requests and when using multicast. Distribution Points can also be used to distribute boot images, including PXE-enabled boot images, to deploy operating systems. Overall, the primary function of a Distribution Point is to provide a location for devices to access and download content, such as software updates and boot images.","A Distribution Point stores and distributes content such as applications, packages, operating system images, and software updates to clients.",1.0,0.8339145770563742,0.499999999975,1.0
What are Boundary Groups?,"['Overview of boundaries and boundary groups\n\n\n\n\n\n\nFeedback\n\n\n\n\n\n\n\n\n\n\n\t\t\t\t\t\tSummarize this article for me\n\t\t\t\t\t\n\n\n\n\n\n\n\n\t\t\t\tIn this article\n\t\t\t\n\nApplies to: Configuration Manager (current branch)\nBoundaries in Configuration Manager define network locations on your intranet. These locations include devices that you want to manage. Boundary groups are logical groups of boundaries that you configure. A hierarchy can include any number of boundary groups. Each boundary group can contain any combination of the following boundary types:\n\nIP subnet\nActive Directory site name\nIPv6 prefix\nIP address range\nVPN (starting in version 2006)', 'IP subnet\nActive Directory site name\nIPv6 prefix\nIP address range\nVPN (starting in version 2006)\n\nClients on the intranet evaluate their current network location and then use that information to identify boundary groups to which they belong.\nClients use boundary groups to:\n\nFind an assigned site: Boundary groups enable clients to find a primary site for client assignment. This behavior is also known as automatic site assignment.\n\nFind certain site system roles they can use: Associate a boundary group with certain site system roles. Then the site provides clients with that list of site systems in the boundary group. Clients use these site systems for actions such as finding content or a nearby management point.', 'Alert subscriptions\nApplications and application groups\nApp-V virtual environments\nBoot images\nBoundary groups\nConfiguration items and baselines\nCustom client settings\nDistribution points and distribution point groups\nDriver packages\nEndpoint protection policies (all)\nFolders \nGlobal conditions\nMigration jobs\nOneDrive for Business profiles\nOS images\nOS upgrade packages\nPackages\nQueries\nRemote connection profiles\nScripts\nSites\nSoftware metering rules\nSoftware update groups\nSoftware updates packages\nTask sequences\nUser data and profiles configuration items\nWindows Update client policies', ""State migration point\n\nSoftware update point\n\nManagement point\n\n\nThis behavior enables the client to select the nearest server to communicate with for each request type.\nRecommendations\nUse a mix of the fewest boundaries that meet your needs\nUse whichever boundary type or types you choose that work for your environment. To simplify your management tasks, use boundary types that let you use the fewest number of boundaries you can.\nAvoid overlapping boundaries for automatic site assignment\nAlthough each boundary group supports both site assignment and site system reference, create a separate set of boundary groups to use only for site assignment. Make sure that each boundary in a boundary group isn't a member of another boundary group with a different site assignment."", 'Boundaries and boundary groups - Configuration Manager | Microsoft Learn\n\n\n\n\n\n\n\n\n\n\n\n\n\n\n\n \n\n\n\n\n\n\n\n\n\n\n\n\n\n\n\n\n\n\n\n\n\n\n\n\n\n\n\n\n\n\n\n\n\n\n\n\n\n\n\n\n\n\n\n\n\n\n\n\n\n\n\n\n\n\n\n\n\n\n\n\n\n\n\n\n\n\t\t\tSkip to main content\n\t\t\n\n\t\t\tSkip to Ask Learn chat experience\n\t\t\n\n\n\n\nThis browser is no longer supported.\n\n\t\t\t\t\t\tUpgrade to Microsoft Edge to take advantage of the latest features, security updates, and technical support.\n\t\t\t\t\t\n\n\n\t\t\t\t\t\t\tDownload Microsoft Edge\n\t\t\t\t\t\t\n\n\t\t\t\t\t\t\tMore info about Internet Explorer and Microsoft Edge\n\t\t\t\t\t\t\n\n\n\n\n\n\n\n\n\n\n\n\n\n\n\n\n\n\n\n\n\n\n\n\n\n\n\n\n\n\n\n\n\n\n\n\n\n\n Table of contents \n\n\n\nExit editor mode\n\n\n\n\n\n\n\n\n\n\n\n\n\n\n\n\n\n\n\n\n\n\n\n\n\n\nAsk Learn\n\n\n\n\n\nAsk Learn\n\n\n\n\n\n\n\n\n\n\n\n\nReading mode\n\n\n\nTable of contents\n\n\n\n\n\nRead in English\n\n\n\n\n\nAdd\n\n\n\n\n\nAdd to plan\n\n\n\n\n\nEdit\n\n\n\n\n\n\n\n\nCopy Markdown\n\n\n\n\n\nPrint\n\n\n\n\n\n\n\n\n\n\n\n\n\nNote']","Boundary groups are logical groups of boundaries that you configure in Configuration Manager. A hierarchy can include any number of boundary groups. Each boundary group can contain any combination of boundary types, such as IP subnet, Active Directory site name, IPv6 prefix, IP address range, and VPN. Boundary groups enable clients to find a primary site for client assignment and to find certain site system roles they can use, such as distribution points, management points, and software update points. This allows clients to select the nearest server to communicate with for each request type.",Boundary Groups associate network boundaries with site systems and determine content location and site assignment.,1.0,0.7874091870347956,0.9166666666361111,1.0
How do you configure Boundary Groups?,"['Overview of boundaries and boundary groups\n\n\n\n\n\n\nFeedback\n\n\n\n\n\n\n\n\n\n\n\t\t\t\t\t\tSummarize this article for me\n\t\t\t\t\t\n\n\n\n\n\n\n\n\t\t\t\tIn this article\n\t\t\t\n\nApplies to: Configuration Manager (current branch)\nBoundaries in Configuration Manager define network locations on your intranet. These locations include devices that you want to manage. Boundary groups are logical groups of boundaries that you configure. A hierarchy can include any number of boundary groups. Each boundary group can contain any combination of the following boundary types:\n\nIP subnet\nActive Directory site name\nIPv6 prefix\nIP address range\nVPN (starting in version 2006)', 'Use Configuration Manager Boundary Groups for Delivery Optimization Group ID\nChoose Yes to apply the boundary group identifier as the Delivery Optimization group identifier on the client. When the client communicates with the Delivery Optimization cloud service, it uses this identifier to locate peers with the content. Enabling this setting also sets the Delivery Optimization download mode to the Group (2) option on targeted clients.\n\nNote\nMicrosoft recommends allowing the client to configure this setting via local policy rather than group policy. This allows the boundary group identifier to be set as the Delivery Optimization group identifier on the client. For more information, see Delivery Optimization.', ""You add the same boundary to multiple boundary groups.\n\nYou add separate boundaries that include the client's location to different boundary groups."", 'Alert subscriptions\nApplications and application groups\nApp-V virtual environments\nBoot images\nBoundary groups\nConfiguration items and baselines\nCustom client settings\nDistribution points and distribution point groups\nDriver packages\nEndpoint protection policies (all)\nFolders \nGlobal conditions\nMigration jobs\nOneDrive for Business profiles\nOS images\nOS upgrade packages\nPackages\nQueries\nRemote connection profiles\nScripts\nSites\nSoftware metering rules\nSoftware update groups\nSoftware updates packages\nTask sequences\nUser data and profiles configuration items\nWindows Update client policies', ""State migration point\n\nSoftware update point\n\nManagement point\n\n\nThis behavior enables the client to select the nearest server to communicate with for each request type.\nRecommendations\nUse a mix of the fewest boundaries that meet your needs\nUse whichever boundary type or types you choose that work for your environment. To simplify your management tasks, use boundary types that let you use the fewest number of boundaries you can.\nAvoid overlapping boundaries for automatic site assignment\nAlthough each boundary group supports both site assignment and site system reference, create a separate set of boundary groups to use only for site assignment. Make sure that each boundary in a boundary group isn't a member of another boundary group with a different site assignment.""]","1. Define network locations as boundaries, which can include IP subnet, Active Directory site name, IPv6 prefix, IP address range, or VPN.
2. Create a boundary group.
3. Add boundaries to the boundary group.
4. Assign site systems to the boundary group.","Boundary Groups are configured by creating boundaries, grouping them, and assigning site systems.",0.8888888888888888,0.764825603029919,0.7555555555303703,1.0
What are Discovery Methods in SCCM?,"['Configure discovery operations throughout the hierarchy from the central administration site. From the central administration site, assign discovery methods to run at individual primary sites.\n\nManage security throughout the hierarchy by assigning different security roles, security scopes, and collections to different administrative users. These configurations apply at each site in the hierarchy.\n\nConfigure replication to control communication between sites in the hierarchy. Schedule database replication for site data, and managing the bandwidth for the transfer of file-based data between sites.', ""Server discovery\nConfigurable: No\nIn addition to the user-configurable discovery methods, Configuration Manager uses a process named Server Discovery (SMS_WINNT_SERVER_DISCOVERY_AGENT). This discovery method creates resource records for computers that are site systems, like a computer that is configured as a management point.\n Common features of Active Directory group discovery, system discovery, and user discovery\nThis section provides information about features that are common to the following discovery methods:\n\nActive Directory group discovery\n\nActive Directory system discovery\n\nActive Directory user discovery\n\n\n\nNote\nThe information in this section doesn't apply to Active Directory forest discovery."", 'This discovery method is intended to identify groups and the group relationships of members of groups. By default, only security groups are discovered. If you want to also find the membership of distribution groups, you must check the box for the option Discover the membership of distribution groups on the Option tab in the Active Directory Group Discovery Properties dialog box.', 'Network location\n\nNetBIOS name\n\nVersion of the client agent\n\nOperational status details\n\n\nHeartbeat discovery is the only discovery method that provides details about the client installation status. It does so by updating the system resource client attribute to set a value equal to Yes.\nActions for heartbeat discovery are logged on the client in the InventoryAgent.log file in the %Windir%\\CCM\\Logs folder.\nFor more information about how to configure this discovery method, see Configure discovery methods.\n Network discovery\nConfigurable: Yes\nEnabled by default: No\nAccounts you can use to run this method:\n\nComputer account of the site server', 'Computer account of the site server\n\nUse this method to discover the topology of your network and to discover devices on your network that have an IP address. Network discovery searches your network for IP-enabled resources by querying the following sources:\n\nServers that run a Microsoft implementation of DHCP\nAddress Resolution Protocol (ARP) caches in network routers\nSNMP-enabled devices\nActive Directory domains']","Discovery methods in SCCM are processes used to identify and discover resources, such as computers, users, and groups, within an organization's network. These methods are used to create resource records for discovered devices and users, which can then be managed by Configuration Manager. There are several types of discovery methods, including Active Directory group discovery, Active Directory system discovery, Active Directory user discovery, heartbeat discovery, network discovery, and server discovery. Each discovery method has its own unique features and purposes, such as identifying groups and group relationships, discovering devices on the network, or updating client installation status. Discovery methods can be configured and managed throughout the hierarchy from the central administration site, and can be used to control communication between sites and manage security roles and scopes.","Discovery Methods locate users, devices, and network resources so they can be managed by Configuration Manager.",0.8461538461538461,0.981844883901147,0.5833333333041666,1.0
